<?xml version="1.0" encoding="UTF-8"?>
<!DOCTYPE ISO8583-config SYSTEM "iso8583.dtd">
<ISO8583-config encoding="BIG5" desc="ipass 設定檔" type="STRING">
	<header length="8" ref="default">FFFF9999</header>
	<parse id="default" desc="IPass">
		<field num="7" type="NUMERIC" length="10" desc="Transmission Date and Time" />
		<field num="11" type="NUMERIC" length="6" desc="System Trace Audit Number" />
		<field num="13" type="NUMERIC" length="4" desc="Transmission Year" />
		<field num="39" type="ALPHA" length="2" desc="Response Code" />
		<field num="70" type="NUMERIC" length="3" desc="Network Management Information Code" />
	</parse>
</ISO8583-config>